{
    "$schema": "http://json-schema.org/draft-07/schema#",
    "title": "ModbusRTUDeviceProfile",
    "type": "object",
    "required": [
        "DeviceType",
        "DeviceModel",
        "Parity",
        "BaudRate",
        "ProbeRegister"
    ],
    "additionalProperties": false,
    "properties": {
        "DeviceType": {
            "type": "string",
            "enum": [
                "BatteryBackupUnit",
                "CapacitorBankUnit",
                "FlowMeter",
                "HeatExchanger",
                "PowerMonitorModule",
                "PowerShelf",
                "PowerSupplyUnit",
                "ReservoirPumpUnit",
                "Valve"
            ]
        },
        "DeviceModel": {
            "type": "string",
            "enum": [
                "Artesyn7000552480000",
                "Artesyn7000552531000",
                "Artesyn7000555240000",
                "BelimoEV200ARXE",
                "Danfoss003Z8540",
                "DeltaBBUBC100AE000",
                "DeltaBBUBS723AE000",
                "DeltaBBUBU123AE000",
                "DeltaECD17020037",
                "DeltaECD27010006",
                "DeltaECD68000047",
                "DeltaECD68000049",
                "DeltaECD70000017",
                "DeltaECD70000020",
                "DeltaRDF040DSS5193E0",
                "PanasonicBJA3C0002A",
                "PanasonicBJBPM103A",
                "PanasonicBJBSB103A"
            ]
        },
        "Parity": {
            "type": "string",
            "enum": ["None", "Even", "Odd"]
        },
        "BaudRate": {
            "type": "integer"
        },
        "ProbeRegister": {
            "type": "object",
            "required": ["Offset", "Size", "ExpectedValue"],
            "additionalProperties": false,
            "properties": {
                "Offset": { "type": "string", "pattern": "^0x[0-9A-Fa-f]+$" },
                "Size": { "type": "integer" },
                "ExpectedValue": {
                    "oneOf": [{ "type": "integer" }, { "type": "string" }]
                }
            }
        },
        "InventoryRegisters": {
            "type": "array",
            "items": {
                "type": "object",
                "required": ["Type", "Offset", "Size"],
                "additionalProperties": false,
                "properties": {
                    "Type": {
                        "type": "string",
                        "enum": [
                            "BuildDate",
                            "Manufacturer",
                            "Model",
                            "PartNumber",
                            "SerialNumber",
                            "SparePartNumber"
                        ]
                    },
                    "Offset": {
                        "type": "string",
                        "pattern": "^0x[0-9A-Fa-f]+$"
                    },
                    "Size": { "type": "integer" },
                    "Format": {
                        "type": "string",
                        "enum": ["String", "Integer"],
                        "default": "String"
                    }
                }
            }
        },
        "SensorRegisters": {
            "type": "array",
            "items": {
                "type": "object",
                "required": ["Name", "Type", "Offset", "Size", "Format"],
                "additionalProperties": false,
                "properties": {
                    "Name": { "type": "string" },
                    "Type": {
                        "type": "string",
                        "enum": [
                            "FanTach",
                            "LiquidFlow",
                            "Power",
                            "Pressure",
                            "Temperature",
                            "Voltage",
                            "Current",
                            "Airflow",
                            "Altitude",
                            "Energy",
                            "Frequency",
                            "Humidity",
                            "Utilization",
                            "Valve",
                            "Charge",
                            "RotationalPosition"
                        ]
                    },
                    "Offset": {
                        "type": "string",
                        "pattern": "^0x[0-9A-Fa-f]+$"
                    },
                    "Size": { "type": "integer" },
                    "Precision": { "type": "integer", "default": 0 },
                    "Scale": { "type": "number", "default": 1.0 },
                    "Shift": { "type": "number", "default": 0.0 },
                    "IsSigned": { "type": "boolean", "default": false },
                    "Format": {
                        "type": "string",
                        "enum": ["FixedPoint", "Float32", "Integer"]
                    }
                },
                "if": {
                    "properties": { "Format": { "const": "Float32" } }
                },
                "then": {
                    "properties": { "Size": { "const": 2 } }
                }
            }
        },
        "StatusRegisters": {
            "type": "array",
            "items": {
                "type": "object",
                "required": ["Offset", "Bits"],
                "additionalProperties": false,
                "properties": {
                    "Name": { "type": "string" },
                    "Offset": {
                        "type": "string",
                        "pattern": "^0x[0-9A-Fa-f]+$"
                    },
                    "Bits": {
                        "type": "array",
                        "items": {
                            "type": "object",
                            "required": [
                                "Name",
                                "Type",
                                "BitPosition",
                                "Value"
                            ],
                            "additionalProperties": false,
                            "properties": {
                                "Name": { "type": "string" },
                                "Type": {
                                    "type": "string",
                                    "enum": [
                                        "ControllerFailure",
                                        "FanFailure",
                                        "FilterFailure",
                                        "PowerFault",
                                        "PumpFailure",
                                        "LeakDetectedCritical",
                                        "LeakDetectedWarning",
                                        "SensorFailure",
                                        "SensorReadingCritical",
                                        "SensorReadingWarning"
                                    ]
                                },
                                "BitPosition": { "type": "integer" },
                                "Value": { "type": "boolean" }
                            }
                        }
                    }
                }
            }
        },
        "MetricRegisters": {
            "type": "array",
            "items": {
                "type": "object",
                "required": ["Name", "Type", "Offset", "Size", "Format"],
                "additionalProperties": false,
                "properties": {
                    "Name": { "type": "string" },
                    "Type": {
                        "type": "string",
                        "enum": ["ValveClosedDuration", "ValveOpenDuration"]
                    },
                    "Offset": {
                        "type": "string",
                        "pattern": "^0x[0-9A-Fa-f]+$"
                    },
                    "Size": { "type": "integer" },
                    "Precision": { "type": "integer", "default": 0 },
                    "Scale": { "type": "number", "default": 1.0 },
                    "Shift": { "type": "number", "default": 0.0 },
                    "IsSigned": { "type": "boolean", "default": false },
                    "Format": {
                        "type": "string",
                        "enum": ["FixedPoint", "Float32", "Integer"]
                    }
                },
                "if": {
                    "properties": { "Format": { "const": "Float32" } }
                },
                "then": {
                    "properties": { "Size": { "const": 2 } }
                }
            }
        },
        "FirmwareRegisters": {
            "type": "array",
            "items": {
                "type": "object",
                "required": ["Name", "Type", "Offset", "Size"],
                "additionalProperties": false,
                "properties": {
                    "Name": { "type": "string" },
                    "Type": {
                        "type": "string",
                        "enum": ["Version", "Update"]
                    },
                    "Format": {
                        "type": "string",
                        "enum": ["String", "Integer"]
                    },
                    "Offset": {
                        "type": "string",
                        "pattern": "^0x[0-9A-Fa-f]+$"
                    },
                    "Size": { "type": "integer" }
                }
            }
        },
        "ConfigRegisters": {
            "type": "array",
            "items": {
                "type": "object",
                "required": ["Type", "Offset"],
                "additionalProperties": false,
                "properties": {
                    "Name": { "type": "string" },
                    "Type": {
                        "type": "string",
                        "enum": ["UnixTime", "Init"]
                    },
                    "Offset": {
                        "type": "string",
                        "pattern": "^0x[0-9A-Fa-f]+$"
                    },
                    "Size": { "type": "integer" },
                    "Period": { "type": "integer" },
                    "Default": {
                        "type": "array",
                        "items": { "type": "integer" }
                    }
                },
                "if": {
                    "properties": { "Type": { "const": "Init" } }
                },
                "then": {
                    "required": ["Name"],
                    "properties": { "Period": false },
                    "anyOf": [
                        { "required": ["Default"] },
                        { "required": ["Size"] }
                    ]
                },
                "else": {
                    "required": ["Size"],
                    "properties": { "Default": false }
                }
            }
        },
        "Blackbox": {
            "description": "The blackbox records a device holds, and how to read them.",
            "type": "object",
            "required": ["Type", "Sections", "Length"],
            "additionalProperties": false,
            "properties": {
                "Type": {
                    "description": "How a section is read.",
                    "type": "string",
                    "enum": ["FileRecord", "Mailbox"]
                },
                "Sections": {
                    "description": "The file numbers, or record indices, the blackbox is made of.",
                    "type": "array",
                    "minItems": 1,
                    "items": { "type": "integer", "minimum": 0 }
                },
                "Length": {
                    "description": "Registers in a section.",
                    "type": "integer",
                    "minimum": 1
                },
                "SelectRegister": {
                    "description": "Mailbox only. Written with the section to load.",
                    "type": "string",
                    "pattern": "^0x[0-9A-Fa-f]+$"
                },
                "StatusRegister": {
                    "description": "Mailbox only. Reads BusyValue until the section is loaded.",
                    "type": "string",
                    "pattern": "^0x[0-9A-Fa-f]+$"
                },
                "BusyValue": {
                    "description": "Mailbox only. What StatusRegister reads while a section is loading.",
                    "type": "string",
                    "pattern": "^0x[0-9A-Fa-f]+$"
                },
                "DataRegister": {
                    "description": "Mailbox only. Where a loaded section is read from.",
                    "type": "string",
                    "pattern": "^0x[0-9A-Fa-f]+$"
                }
            },
            "if": { "properties": { "Type": { "const": "Mailbox" } } },
            "then": {
                "required": [
                    "SelectRegister",
                    "StatusRegister",
                    "BusyValue",
                    "DataRegister"
                ]
            },
            "else": {
                "properties": {
                    "SelectRegister": false,
                    "StatusRegister": false,
                    "BusyValue": false,
                    "DataRegister": false
                }
            }
        }
    }
}
