{
    "DeviceType": "ReservoirPumpUnit",
    "DeviceModel": "DeltaRDF040DSS5193E0",
    "Parity": "None",
    "BaudRate": 19200,
    "ProbeRegister": {
        "Offset": "0x19CC",
        "Size": 8,
        "ExpectedValue": "RDF040DSS5193E0"
    },
    "InventoryRegisters": [
        {
            "Type": "Model",
            "Offset": "0x19CC",
            "Size": 8
        },
        {
            "Type": "BuildDate",
            "Offset": "0x19D4",
            "Size": 4
        },
        {
            "Type": "SerialNumber",
            "Offset": "0x19D8",
            "Size": 8
        },
        {
            "Type": "SparePartNumber",
            "Offset": "0x19FC",
            "Size": 4
        }
    ],
    "SensorRegisters": [
        {
            "Name": "RPU_COOLANT_INLET_TEMP",
            "Type": "Temperature",
            "Offset": "0x9002",
            "Size": 1,
            "Precision": 0,
            "Scale": 0.1,
            "Shift": 0.0,
            "IsSigned": true,
            "Format": "FixedPoint"
        },
        {
            "Name": "RPU_COOLANT_OUTLET_TEMP",
            "Type": "Temperature",
            "Offset": "0x9001",
            "Size": 1,
            "Precision": 0,
            "Scale": 0.1,
            "Shift": 0.0,
            "IsSigned": true,
            "Format": "FixedPoint"
        }
    ],
    "StatusRegisters": [
        {
            "Offset": "0x9201",
            "Bits": [
                {
                    "Name": "RPU_COOLANT_INLET_TEMP_C",
                    "Type": "SensorReadingCritical",
                    "BitPosition": 2,
                    "Value": true
                },
                {
                    "Name": "RPU_COOLANT_OUTLET_TEMP_C",
                    "Type": "SensorReadingCritical",
                    "BitPosition": 1,
                    "Value": true
                }
            ]
        },
        {
            "Offset": "0x9200",
            "Bits": [
                {
                    "Name": "RPU_COOLANT_INLET_TEMP_C",
                    "Type": "SensorFailure",
                    "BitPosition": 0,
                    "Value": true
                },
                {
                    "Name": "RPU_COOLANT_OUTLET_TEMP_C",
                    "Type": "SensorFailure",
                    "BitPosition": 1,
                    "Value": true
                }
            ]
        }
    ],
    "FirmwareRegisters": [
        {
            "Name": "RPU_PLC_FW_Revision",
            "Type": "Version",
            "Offset": "0x19E8",
            "Size": 4
        }
    ]
}
