{
    "DeviceType": "CapacitorBankUnit",
    "DeviceModel": "DeltaECD27010006",
    "Parity": "Even",
    "BaudRate": 115200,
    "ProbeRegister": {
        "Offset": "0x0",
        "Size": 8,
        "ExpectedValue": "Delta"
    },
    "InventoryRegisters": [
        {
            "Type": "Manufacturer",
            "Offset": "0x0",
            "Size": 8
        },
        {
            "Type": "Model",
            "Offset": "0x8",
            "Size": 8
        },
        {
            "Type": "BuildDate",
            "Offset": "0x10",
            "Size": 8
        },
        {
            "Type": "SparePartNumber",
            "Offset": "0x18",
            "Size": 8
        },
        {
            "Type": "SerialNumber",
            "Offset": "0x40",
            "Size": 16
        }
    ],
    "FirmwareRegisters": [
        {
            "Name": "CBU_FW_Revision",
            "Type": "Version",
            "Offset": "0x38",
            "Size": 4
        }
    ],
    "SensorRegisters": [],
    "StatusRegisters": [
        {
            "Name": "STATUS",
            "Offset": "0x68",
            "Bits": [
                {
                    "Name": "DISCHARGE_NOT_ALLOWED",
                    "Type": "PowerFault",
                    "BitPosition": 15,
                    "Value": true
                },
                {
                    "Name": "CHARGE_NOT_ALLOWED",
                    "Type": "PowerFault",
                    "BitPosition": 14,
                    "Value": true
                },
                {
                    "Name": "TEMPERATURE_FAILURE",
                    "Type": "SensorReadingCritical",
                    "BitPosition": 13,
                    "Value": true
                },
                {
                    "Name": "PACK_OVER_CURRENT",
                    "Type": "SensorReadingCritical",
                    "BitPosition": 12,
                    "Value": true
                },
                {
                    "Name": "CELL_UNDER_VOLTAGE",
                    "Type": "SensorReadingCritical",
                    "BitPosition": 11,
                    "Value": true
                },
                {
                    "Name": "PACK_UNDER_VOLTAGE",
                    "Type": "SensorReadingCritical",
                    "BitPosition": 10,
                    "Value": true
                },
                {
                    "Name": "CELL_OVER_VOLTAGE",
                    "Type": "SensorReadingCritical",
                    "BitPosition": 9,
                    "Value": true
                },
                {
                    "Name": "PACK_OVER_VOLTAGE",
                    "Type": "SensorReadingCritical",
                    "BitPosition": 8,
                    "Value": true
                },
                {
                    "Name": "EOL",
                    "Type": "ControllerFailure",
                    "BitPosition": 7,
                    "Value": true
                },
                {
                    "Name": "FAN_FAILURE",
                    "Type": "FanFailure",
                    "BitPosition": 6,
                    "Value": true
                },
                {
                    "Name": "CELL_BALANCING_FAILURE",
                    "Type": "ControllerFailure",
                    "BitPosition": 5,
                    "Value": true
                }
            ]
        },
        {
            "Name": "STATUS_WORD",
            "Offset": "0x99",
            "Bits": [
                {
                    "Name": "FAN_3_FAULT",
                    "Type": "FanFailure",
                    "BitPosition": 5,
                    "Value": true
                },
                {
                    "Name": "FAN_2_FAULT",
                    "Type": "FanFailure",
                    "BitPosition": 4,
                    "Value": true
                },
                {
                    "Name": "FAN_1_FAULT",
                    "Type": "FanFailure",
                    "BitPosition": 3,
                    "Value": true
                },
                {
                    "Name": "BUCK_MODE_FAULT",
                    "Type": "PowerFault",
                    "BitPosition": 2,
                    "Value": true
                },
                {
                    "Name": "BOOST_MODE_FAULT",
                    "Type": "PowerFault",
                    "BitPosition": 1,
                    "Value": true
                },
                {
                    "Name": "TEMPERATURE_FAULT",
                    "Type": "SensorReadingCritical",
                    "BitPosition": 0,
                    "Value": true
                }
            ]
        },
        {
            "Name": "STATUS_POWER_CHARGER",
            "Offset": "0x9A",
            "Bits": [
                {
                    "Name": "DISCHARGE_INPUT_UNDER_VOLTAGE",
                    "Type": "SensorReadingCritical",
                    "BitPosition": 4,
                    "Value": true
                },
                {
                    "Name": "DISCHARGE_OUTPUT_OVER_VOLTAGE",
                    "Type": "SensorReadingCritical",
                    "BitPosition": 2,
                    "Value": true
                },
                {
                    "Name": "DISCHARGE_OUTPUT_OVER_CURRENT",
                    "Type": "SensorReadingCritical",
                    "BitPosition": 1,
                    "Value": true
                }
            ]
        },
        {
            "Name": "STATUS_POWER_DISCHARGER",
            "Offset": "0x9B",
            "Bits": [
                {
                    "Name": "CHARGE_OUTPUT_OVER_VOLTAGE",
                    "Type": "SensorReadingCritical",
                    "BitPosition": 3,
                    "Value": true
                },
                {
                    "Name": "CHARGE_INPUT_UNDER_VOLTAGE",
                    "Type": "SensorReadingCritical",
                    "BitPosition": 2,
                    "Value": true
                },
                {
                    "Name": "CHARGE_OUTPUT_OVER_CURRENT",
                    "Type": "SensorReadingCritical",
                    "BitPosition": 0,
                    "Value": true
                }
            ]
        },
        {
            "Name": "STATUS_TEMP",
            "Offset": "0x9D",
            "Bits": [
                {
                    "Name": "SUPERCAP_PACK_OVER_TEMP",
                    "Type": "SensorReadingCritical",
                    "BitPosition": 4,
                    "Value": true
                },
                {
                    "Name": "DCDC_MODULE2_OVER_TEMP",
                    "Type": "SensorReadingCritical",
                    "BitPosition": 3,
                    "Value": true
                },
                {
                    "Name": "DCDC_MODULE1_OVER_TEMP",
                    "Type": "SensorReadingCritical",
                    "BitPosition": 2,
                    "Value": true
                },
                {
                    "Name": "OUTPUT_AMBIENT_OVER_TEMP",
                    "Type": "SensorReadingCritical",
                    "BitPosition": 1,
                    "Value": true
                },
                {
                    "Name": "BUSBAR_CLIP_OVER_TEMP",
                    "Type": "SensorReadingCritical",
                    "BitPosition": 5,
                    "Value": true
                },
                {
                    "Name": "INPUT_AMBIENT_OVER_TEMP",
                    "Type": "SensorReadingCritical",
                    "BitPosition": 0,
                    "Value": true
                }
            ]
        },
        {
            "Name": "HW_SIGNAL",
            "Offset": "0xA4",
            "Bits": [
                {
                    "Name": "AC_LOSS_DETECTED",
                    "Type": "PowerFault",
                    "BitPosition": 10,
                    "Value": true
                },
                {
                    "Name": "DAISY_CHAIN_FAILURE",
                    "Type": "ControllerFailure",
                    "BitPosition": 8,
                    "Value": true
                },
                {
                    "Name": "ISHARE_CABLE_NOT_DETECTED",
                    "Type": "ControllerFailure",
                    "BitPosition": 0,
                    "Value": true
                }
            ]
        }
    ],
    "ConfigRegisters": [
        {
            "Type": "UnixTime",
            "Offset": "0x65",
            "Size": 2,
            "Period": 3600
        }
    ]
}
