{
    "DeviceType": "Valve",
    "DeviceModel": "Danfoss003Z8540",
    "Parity": "None",
    "BaudRate": 19200,
    "ProbeRegister": {
        "Offset": "0x8160",
        "Size": 25,
        "ExpectedValue": "Danfoss A/S"
    },
    "InventoryRegisters": [
        {
            "Type": "Model",
            "Offset": "0x8120",
            "Size": 25
        },
        {
            "Type": "PartNumber",
            "Offset": "0x8140",
            "Size": 25
        },
        {
            "Type": "Manufacturer",
            "Offset": "0x8160",
            "Size": 25
        },
        {
            "Type": "SerialNumber",
            "Offset": "0x81A0",
            "Size": 25
        },
        {
            "Type": "SparePartNumber",
            "Offset": "0x810B",
            "Size": 1
        }
    ],
    "SensorRegisters": [
        {
            "Name": "ESTIMATED_FLOW_RATE_UTIL",
            "Type": "Utilization",
            "Offset": "0x8608",
            "Size": 2,
            "Precision": 0,
            "Scale": 1.0,
            "Shift": 0.0,
            "IsSigned": false,
            "Format": "Float32"
        },
        {
            "Name": "ACTUATOR_SPINDLE_POSITION_UTIL",
            "Type": "Utilization",
            "Offset": "0x860E",
            "Size": 2,
            "Precision": 0,
            "Scale": 1.0,
            "Shift": 0.0,
            "IsSigned": false,
            "Format": "Float32"
        },
        {
            "Name": "ANALOG_OUTPUT_VOLT",
            "Type": "Voltage",
            "Offset": "0x8206",
            "Size": 2,
            "Precision": 0,
            "Scale": 1.0,
            "Shift": 0.0,
            "IsSigned": false,
            "Format": "Float32"
        },
        {
            "Name": "SUPPLY_TEMP",
            "Type": "Temperature",
            "Offset": "0x81C2",
            "Size": 2,
            "Precision": 0,
            "Scale": 1.0,
            "Shift": 0.0,
            "IsSigned": false,
            "Format": "Float32"
        },
        {
            "Name": "ANALOG_INPUT_VOLT",
            "Type": "Voltage",
            "Offset": "0x81C0",
            "Size": 2,
            "Precision": 0,
            "Scale": 1.0,
            "Shift": 0.0,
            "IsSigned": false,
            "Format": "Float32"
        },
        {
            "Name": "FILTERED_VALVE_DIFF_PRESSURE",
            "Type": "Pressure",
            "Offset": "0x8612",
            "Size": 2,
            "Precision": 0,
            "Scale": 1000.0,
            "Shift": 0.0,
            "IsSigned": false,
            "Format": "Float32"
        },
        {
            "Name": "DESIGN_FLOW_RATE_LIQUIDFLOW",
            "Type": "LiquidFlow",
            "Offset": "0x8000",
            "Size": 2,
            "Precision": 0,
            "Scale": 0.0166667,
            "Shift": 0.0,
            "IsSigned": false,
            "Format": "Float32"
        }
    ],
    "MetricRegisters": [
        {
            "Name": "FULLY_CLOSED_DURATION",
            "Type": "ValveClosedDuration",
            "Offset": "0x8414",
            "Size": 2,
            "Precision": 0,
            "Scale": 60.0,
            "Shift": 0.0,
            "IsSigned": true,
            "Format": "FixedPoint"
        },
        {
            "Name": "FULLY_OPEN_DURATION",
            "Type": "ValveOpenDuration",
            "Offset": "0x8416",
            "Size": 2,
            "Precision": 0,
            "Scale": 60.0,
            "Shift": 0.0,
            "IsSigned": true,
            "Format": "FixedPoint"
        }
    ],
    "StatusRegisters": [
        {
            "Offset": "0x8300",
            "Bits": [
                {
                    "Name": "TEMPERATURE_OUT_OF_RANGE",
                    "Type": "SensorReadingCritical",
                    "BitPosition": 0,
                    "Value": true
                },
                {
                    "Name": "POWER_SUPPLY_VOLTAGE_TOO_HIGH",
                    "Type": "SensorReadingCritical",
                    "BitPosition": 2,
                    "Value": true
                },
                {
                    "Name": "POWER_SUPPLY_VOLTAGE_TOO_LOW",
                    "Type": "SensorReadingCritical",
                    "BitPosition": 3,
                    "Value": true
                },
                {
                    "Name": "COMMUNICATION_FAULTS",
                    "Type": "ControllerFailure",
                    "BitPosition": 5,
                    "Value": true
                },
                {
                    "Name": "INVALID_SLAVE_ID_SETTING",
                    "Type": "ControllerFailure",
                    "BitPosition": 6,
                    "Value": true
                }
            ]
        },
        {
            "Offset": "0x8301",
            "Bits": [
                {
                    "Name": "NO_CONTROL_SIGNAL",
                    "Type": "ControllerFailure",
                    "BitPosition": 0,
                    "Value": true
                },
                {
                    "Name": "ERROR_DURING_MOVEMENT",
                    "Type": "SensorFailure",
                    "BitPosition": 1,
                    "Value": true
                },
                {
                    "Name": "ERROR_DURING_CALIBRATION",
                    "Type": "SensorFailure",
                    "BitPosition": 2,
                    "Value": true
                },
                {
                    "Name": "INTERNAL_ERROR",
                    "Type": "SensorFailure",
                    "BitPosition": 3,
                    "Value": true
                }
            ]
        }
    ],
    "FirmwareRegisters": [
        {
            "Name": "SW_Version",
            "Type": "Version",
            "Offset": "0x110",
            "Size": 25
        }
    ]
}
