{
    "DeviceType": "PowerMonitorModule",
    "DeviceModel": "DeltaBBUBC100AE000",
    "Parity": "Even",
    "BaudRate": 115200,
    "ProbeRegister": {
        "Offset": "0x8",
        "Size": 8,
        "ExpectedValue": "Delta"
    },
    "InventoryRegisters": [
        {
            "Type": "SparePartNumber",
            "Offset": "0x0",
            "Size": 8
        },
        {
            "Type": "Manufacturer",
            "Offset": "0x8",
            "Size": 8
        },
        {
            "Type": "Model",
            "Offset": "0x10",
            "Size": 8
        },
        {
            "Type": "BuildDate",
            "Offset": "0x18",
            "Size": 8
        },
        {
            "Type": "SerialNumber",
            "Offset": "0x20",
            "Size": 16
        }
    ],
    "FirmwareRegisters": [
        {
            "Name": "PMM_FW_Revision",
            "Type": "Version",
            "Offset": "0x38",
            "Size": 4
        }
    ],
    "SensorRegisters": [],
    "StatusRegisters": [
        {
            "Name": "GEN_ALARM",
            "Offset": "0x59",
            "Bits": [
                {
                    "Name": "MISSING_MODULES",
                    "Type": "ControllerFailure",
                    "BitPosition": 0,
                    "Value": true
                },
                {
                    "Name": "SHELF_EEPROM_FAULT",
                    "Type": "ControllerFailure",
                    "BitPosition": 1,
                    "Value": true
                },
                {
                    "Name": "MODULE_MODBUS_COMM_ERR",
                    "Type": "ControllerFailure",
                    "BitPosition": 4,
                    "Value": true
                },
                {
                    "Name": "PMM_MODBUS_COMM_ERR",
                    "Type": "ControllerFailure",
                    "BitPosition": 5,
                    "Value": true
                },
                {
                    "Name": "SERIAL_LINK_FAULT",
                    "Type": "ControllerFailure",
                    "BitPosition": 6,
                    "Value": true
                },
                {
                    "Name": "MODULE_ALERTS",
                    "Type": "ControllerFailure",
                    "BitPosition": 8,
                    "Value": true
                },
                {
                    "Name": "BB_OVER_TEMP_WARN",
                    "Type": "SensorReadingWarning",
                    "BitPosition": 9,
                    "Value": true
                },
                {
                    "Name": "BB_OVER_TEMP_ALARM",
                    "Type": "SensorReadingCritical",
                    "BitPosition": 10,
                    "Value": true
                },
                {
                    "Name": "ISHARE_CABLE_NOT_DETECTED",
                    "Type": "ControllerFailure",
                    "BitPosition": 12,
                    "Value": true
                }
            ]
        },
        {
            "Name": "COMM_ALARM",
            "Offset": "0x5D",
            "Bits": [
                {
                    "Name": "RX_SERIAL_INPUT_FAILURE",
                    "Type": "ControllerFailure",
                    "BitPosition": 0,
                    "Value": true
                },
                {
                    "Name": "MODULE1_MODBUS_FAULT",
                    "Type": "ControllerFailure",
                    "BitPosition": 1,
                    "Value": true
                },
                {
                    "Name": "MODULE2_MODBUS_FAULT",
                    "Type": "ControllerFailure",
                    "BitPosition": 2,
                    "Value": true
                },
                {
                    "Name": "MODULE3_MODBUS_FAULT",
                    "Type": "ControllerFailure",
                    "BitPosition": 3,
                    "Value": true
                },
                {
                    "Name": "MODULE4_MODBUS_FAULT",
                    "Type": "ControllerFailure",
                    "BitPosition": 4,
                    "Value": true
                },
                {
                    "Name": "MODULE5_MODBUS_FAULT",
                    "Type": "ControllerFailure",
                    "BitPosition": 5,
                    "Value": true
                },
                {
                    "Name": "MODULE6_MODBUS_FAULT",
                    "Type": "ControllerFailure",
                    "BitPosition": 6,
                    "Value": true
                },
                {
                    "Name": "SHELF_EEPROM_FAULT",
                    "Type": "ControllerFailure",
                    "BitPosition": 8,
                    "Value": true
                },
                {
                    "Name": "MODULE7_MODBUS_FAULT",
                    "Type": "ControllerFailure",
                    "BitPosition": 9,
                    "Value": true
                },
                {
                    "Name": "MODULE8_MODBUS_FAULT",
                    "Type": "ControllerFailure",
                    "BitPosition": 10,
                    "Value": true
                },
                {
                    "Name": "MODULE9_MODBUS_FAULT",
                    "Type": "ControllerFailure",
                    "BitPosition": 11,
                    "Value": true
                },
                {
                    "Name": "MODULE10_MODBUS_FAULT",
                    "Type": "ControllerFailure",
                    "BitPosition": 12,
                    "Value": true
                },
                {
                    "Name": "MODULE11_MODBUS_FAULT",
                    "Type": "ControllerFailure",
                    "BitPosition": 13,
                    "Value": true
                }
            ]
        }
    ],
    "ConfigRegisters": [
        {
            "Type": "UnixTime",
            "Offset": "0x50",
            "Size": 2,
            "Period": 3600
        }
    ]
}
