{
    "DeviceType": "Valve",
    "DeviceModel": "BelimoEV200ARXE",
    "Parity": "None",
    "BaudRate": 19200,
    "ProbeRegister": {
        "Offset": "0x3",
        "Size": 1,
        "ExpectedValue": 4
    },
    "InventoryRegisters": [
        {
            "Type": "PartNumber",
            "Offset": "0x3",
            "Size": 1,
            "Format": "Integer"
        }
    ],
    "SensorRegisters": [
        {
            "Name": "SENSOR_TEMP",
            "Type": "Temperature",
            "Offset": "0xD",
            "Size": 1,
            "Precision": 0,
            "Scale": 0.01,
            "Shift": 0.0,
            "IsSigned": true,
            "Format": "FixedPoint"
        },
        {
            "Name": "REMOTE_TEMP",
            "Type": "Temperature",
            "Offset": "0x13",
            "Size": 1,
            "Precision": 0,
            "Scale": 0.01,
            "Shift": 0.0,
            "IsSigned": true,
            "Format": "FixedPoint"
        },
        {
            "Name": "FLOWBODY_TEMP",
            "Type": "Temperature",
            "Offset": "0x15",
            "Size": 1,
            "Precision": 0,
            "Scale": 0.01,
            "Shift": 0.0,
            "IsSigned": true,
            "Format": "FixedPoint"
        },
        {
            "Name": "RELATIVE_VOLUMETRIC_FLOW_UTIL",
            "Type": "Utilization",
            "Offset": "0x6",
            "Size": 1,
            "Precision": 0,
            "Scale": 0.01,
            "Shift": 0.0,
            "IsSigned": false,
            "Format": "FixedPoint"
        },
        {
            "Name": "ABSOLUTE_VOLUMETRIC_RATE_LIQUIDFLOW",
            "Type": "LiquidFlow",
            "Offset": "0x8",
            "Size": 1,
            "Precision": 0,
            "Scale": 0.378541,
            "Shift": 0.0,
            "IsSigned": false,
            "Format": "FixedPoint"
        },
        {
            "Name": "SETPOINT_ABSOLUTE_VOLUMETRIC_RATE_LIQUIDFLOW",
            "Type": "LiquidFlow",
            "Offset": "0x10",
            "Size": 1,
            "Precision": 0,
            "Scale": 0.378541,
            "Shift": 0.0,
            "IsSigned": false,
            "Format": "FixedPoint"
        },
        {
            "Name": "MINIMUM_VOLUMETRIC_FLOW_LIMIT_UTIL",
            "Type": "Utilization",
            "Offset": "0x69",
            "Size": 1,
            "Precision": 0,
            "Scale": 0.01,
            "Shift": 0.0,
            "IsSigned": false,
            "Format": "FixedPoint"
        },
        {
            "Name": "MAXIMUM_VOLUMETRIC_FLOW_LIMIT_UTIL",
            "Type": "Utilization",
            "Offset": "0x6A",
            "Size": 1,
            "Precision": 0,
            "Scale": 0.01,
            "Shift": 0.0,
            "IsSigned": false,
            "Format": "FixedPoint"
        },
        {
            "Name": "SETPOINT_RELATIVE_UTIL",
            "Type": "Utilization",
            "Offset": "0x0",
            "Size": 1,
            "Precision": 0,
            "Scale": 0.01,
            "Shift": 0.0,
            "IsSigned": false,
            "Format": "FixedPoint"
        },
        {
            "Name": "RELATIVE_POSITION_UTIL",
            "Type": "Utilization",
            "Offset": "0x4",
            "Size": 1,
            "Precision": 0,
            "Scale": 0.01,
            "Shift": 0.0,
            "IsSigned": false,
            "Format": "FixedPoint"
        },
        {
            "Name": "ABSOLUTE_ROTATIONALPOS",
            "Type": "RotationalPosition",
            "Offset": "0x5",
            "Size": 1,
            "Precision": 0,
            "Scale": 0.000174533,
            "Shift": 0.0,
            "IsSigned": false,
            "Format": "FixedPoint"
        },
        {
            "Name": "SETPOINT_ANALOG_UTIL",
            "Type": "Utilization",
            "Offset": "0xB",
            "Size": 1,
            "Precision": 0,
            "Scale": 0.01,
            "Shift": 0.0,
            "IsSigned": false,
            "Format": "FixedPoint"
        },
        {
            "Name": "GLYCOL_CONCENTRATION_UTIL",
            "Type": "Utilization",
            "Offset": "0x19",
            "Size": 1,
            "Precision": 0,
            "Scale": 0.01,
            "Shift": 0.0,
            "IsSigned": false,
            "Format": "FixedPoint"
        }
    ],
    "StatusRegisters": [
        {
            "Offset": "0x9D",
            "Bits": [
                {
                    "Name": "COMMUNICATION_WITH_ACTUATOR_NOT_POSSIBLE",
                    "Type": "ControllerFailure",
                    "BitPosition": 0,
                    "Value": true
                },
                {
                    "Name": "GEAR_TRAIN_DISENGAGED",
                    "Type": "ControllerFailure",
                    "BitPosition": 1,
                    "Value": true
                },
                {
                    "Name": "ACTUATOR_BLOCKED",
                    "Type": "ControllerFailure",
                    "BitPosition": 2,
                    "Value": true
                },
                {
                    "Name": "REVERSE_FLOW",
                    "Type": "SensorReadingCritical",
                    "BitPosition": 3,
                    "Value": true
                },
                {
                    "Name": "SETPOINT_NOT_REACHED",
                    "Type": "SensorReadingCritical",
                    "BitPosition": 4,
                    "Value": true
                },
                {
                    "Name": "FLOW_WITH_CLOSED_VALVE",
                    "Type": "SensorReadingCritical",
                    "BitPosition": 5,
                    "Value": true
                },
                {
                    "Name": "ACTUAL_FLOW_EXCEEDS_NOMINAL",
                    "Type": "SensorReadingCritical",
                    "BitPosition": 6,
                    "Value": true
                },
                {
                    "Name": "FLOW_MEASUREMENT_ERROR",
                    "Type": "SensorFailure",
                    "BitPosition": 7,
                    "Value": true
                },
                {
                    "Name": "REMOTE_TEMPERATURE_ERROR",
                    "Type": "SensorFailure",
                    "BitPosition": 8,
                    "Value": true
                },
                {
                    "Name": "FLOWBODY_TEMPERATURE_ERROR",
                    "Type": "SensorFailure",
                    "BitPosition": 9,
                    "Value": true
                },
                {
                    "Name": "FLOW_SENSOR_COMMUNICATION_INTERRUPTED",
                    "Type": "ControllerFailure",
                    "BitPosition": 10,
                    "Value": true
                },
                {
                    "Name": "FREEZE_WARNING",
                    "Type": "SensorReadingCritical",
                    "BitPosition": 11,
                    "Value": true
                },
                {
                    "Name": "GLYCOL_DETECTED",
                    "Type": "SensorReadingCritical",
                    "BitPosition": 12,
                    "Value": true
                },
                {
                    "Name": "POWER_SETPOINT_NOT_REACHED",
                    "Type": "SensorReadingCritical",
                    "BitPosition": 13,
                    "Value": true
                },
                {
                    "Name": "DEVICE_END_OF_LIFE",
                    "Type": "SensorFailure",
                    "BitPosition": 14,
                    "Value": true
                },
                {
                    "Name": "BUS_WATCHDOG_TIMEOUT",
                    "Type": "ControllerFailure",
                    "BitPosition": 15,
                    "Value": true
                }
            ]
        },
        {
            "Offset": "0x9E",
            "Bits": [
                {
                    "Name": "NO_DIFFERENTIAL_PRESSURE_DETECTED",
                    "Type": "SensorReadingCritical",
                    "BitPosition": 0,
                    "Value": true
                },
                {
                    "Name": "DIFFERENTIAL_PRESSURE_SETPOINT_NOT_REACHED",
                    "Type": "SensorReadingCritical",
                    "BitPosition": 1,
                    "Value": true
                },
                {
                    "Name": "MINIMUM_POSITION_APPLIED",
                    "Type": "SensorReadingWarning",
                    "BitPosition": 2,
                    "Value": true
                }
            ]
        }
    ],
    "FirmwareRegisters": []
}
